{
  "$schema": "https://json-schema.org/draft/2020-12/schema",
  "$id": "persona-pipeline/persona.schema.json",
  "title": "Persona declaration, plugins/<persona>/persona.json (ADR-0066 Decision 2)",
  "description": "Format 1.0 holds identity, the deliverable noun, the runtime footer floor, the capabilities and the decide data; 1.1 adds verbs, each verb's profiles, default profile, request placeholder, ensemble type, phase-note artifact sections and proposal texts. Peer policy arrives with a later minor. Cross-field rules the schema cannot state (the decide fallback equals the registry preset, profile_presets needs its map, tie_break names a fallback axis, a verb's default profile is one of its profiles, each enrolled unit's and region's fields are present) are checked by scripts/sync-persona-pipeline.mjs. Validated with the closed keyword subset of plugins/runtime/scripts/lib/schema-validate.mjs.",
  "type": "object",
  "additionalProperties": false,
  "required": ["schema", "name", "capabilities", "decide"],
  "properties": {
    "schema": {
      "description": "The declaration format, persona-declaration-<major>.<minor>.",
      "type": "string",
      "pattern": "^persona-declaration-1\\.(0|[1-9][0-9]*)$"
    },
    "name": {
      "description": "The persona name; equals the plugin directory and the plugin manifests' name. The state directory, command prefix, re-injection marker, peer-run handle and self-sensor source are derived from it.",
      "type": "string",
      "pattern": "^[a-z][a-z0-9-]*$",
      "maxLength": 32
    },
    "deliverable_noun": {
      "description": "The deliverable as user-facing messages name it, e.g. 'business deliverable' (V2).",
      "type": "string",
      "pattern": "^[a-z][a-z '/-]*[a-z]$",
      "maxLength": 64
    },
    "runtime_footer_floor": {
      "description": "The oldest runtime whose footer this persona accepts (V18).",
      "type": "string",
      "pattern": "^(0|[1-9][0-9]*)\\.(0|[1-9][0-9]*)\\.(0|[1-9][0-9]*)$"
    },
    "capabilities": {
      "description": "Every flag is required, so no capability reads as off by absence (ADR-0066 Decision 3).",
      "type": "object",
      "additionalProperties": false,
      "required": ["dispatch_target", "commit_surface", "legacy_homes", "profile_presets"],
      "properties": {
        "dispatch_target": { "type": "boolean" },
        "commit_surface": { "type": "boolean" },
        "legacy_homes": { "type": "boolean" },
        "profile_presets": { "type": "boolean" }
      }
    },
    "decide": {
      "type": "object",
      "additionalProperties": false,
      "required": ["fallback", "size_presets"],
      "properties": {
        "fallback": {
          "description": "The in-code fallback preset (V4); must equal the registry preset of the same id.",
          "type": "object",
          "additionalProperties": false,
          "required": ["preset_id", "axes"],
          "properties": {
            "preset_id": { "$ref": "#/$defs/id" },
            "axes": {
              "type": "array",
              "minItems": 2,
              "maxItems": 16,
              "items": { "$ref": "#/$defs/axis" }
            }
          }
        },
        "size_presets": {
          "description": "--size tier -> preset id (V5).",
          "type": "object",
          "additionalProperties": false,
          "required": ["minor", "standard", "major"],
          "properties": {
            "minor": { "$ref": "#/$defs/id" },
            "standard": { "$ref": "#/$defs/id" },
            "major": { "$ref": "#/$defs/id" }
          }
        },
        "profile_presets": {
          "description": "L4 profile -> preset id (V6); present exactly when capabilities.profile_presets is on.",
          "type": "object",
          "additionalProperties": false,
          "patternProperties": {
            "^[a-z][a-z0-9-]*$": { "$ref": "#/$defs/id" }
          }
        },
        "tie_break": {
          "description": "Axes ranked first when aggregates tie, in order (V8).",
          "type": "array",
          "minItems": 1,
          "maxItems": 16,
          "items": { "$ref": "#/$defs/id" }
        }
      }
    },
    "verbs": {
      "description": "Format 1.1: what differs per verb, keyed by verb. A runbook region reads these values; which fields a verb's regions read is checked by the generator, not here.",
      "type": "object",
      "additionalProperties": false,
      "properties": {
        "investigate": { "$ref": "#/$defs/verb" },
        "frame": { "$ref": "#/$defs/verb" },
        "decide": { "$ref": "#/$defs/verb" },
        "compose": { "$ref": "#/$defs/verb" },
        "critique": { "$ref": "#/$defs/verb" },
        "refine": { "$ref": "#/$defs/verb" },
        "start": { "$ref": "#/$defs/verb" }
      }
    }
  },
  "$defs": {
    "id": {
      "type": "string",
      "pattern": "^[a-z][a-z0-9-]*$",
      "maxLength": 64
    },
    "line": {
      "description": "One line of text: no line break, no NUL.",
      "type": "string",
      "pattern": "^[^\\n\\r\\u0000]+$",
      "maxLength": 512
    },
    "verb": {
      "type": "object",
      "additionalProperties": false,
      "properties": {
        "profiles": {
          "description": "The verb's profiles; default_profile is one of them (checked by the generator).",
          "type": "array",
          "minItems": 1,
          "maxItems": 16,
          "items": { "$ref": "#/$defs/id" }
        },
        "default_profile": { "$ref": "#/$defs/id" },
        "request_placeholder": {
          "description": "What the bootstrap's original request describes, e.g. 'one-line genericized business topic'.",
          "$ref": "#/$defs/line"
        },
        "ensemble_type": {
          "description": "The peer ensemble type, where it differs by persona.",
          "$ref": "#/$defs/id"
        },
        "artifact": {
          "description": "The phase note's artifact sections, one list item per line (an empty item is a blank line).",
          "type": "array",
          "minItems": 1,
          "maxItems": 40,
          "items": {
            "type": "string",
            "pattern": "^[^\\n\\r\\u0000]*$",
            "maxLength": 512
          }
        },
        "rationale_gate": {
          "description": "The proposal's rationale placeholder after 'why best — '.",
          "$ref": "#/$defs/line"
        },
        "evidence_pointers": {
          "description": "The proposal's evidence placeholder before ' — pointers only'.",
          "$ref": "#/$defs/line"
        },
        "next_action": {
          "description": "The next action the finalize step records.",
          "$ref": "#/$defs/line"
        },
        "terminal_requires_convergence": {
          "description": "Whether the verb's terminal write waits for a converged re-critique (ADR-0066 DD5).",
          "type": "boolean"
        }
      }
    },
    "axis": {
      "type": "object",
      "additionalProperties": false,
      "required": ["id", "labels", "question", "role", "gate"],
      "properties": {
        "id": { "$ref": "#/$defs/id" },
        "labels": {
          "type": "object",
          "additionalProperties": false,
          "required": ["en", "ko"],
          "properties": {
            "en": { "type": "string", "maxLength": 128 },
            "ko": { "type": ["string", "null"], "maxLength": 128 }
          }
        },
        "question": { "type": "string", "maxLength": 2048 },
        "role": { "type": "string", "enum": ["decisive", "supporting"] },
        "gate": { "type": "boolean" }
      }
    }
  }
}
